{
  "$schema": "http://json-schema.org/draft-07/schema#",
  "title": "A2UI Evaluation Dataset Schema",
  "description": "Schema for A2UI evaluation datasets and data points.",
  "type": "array",
  "items": {
    "type": "object",
    "properties": {
      "name": {
        "type": "string",
        "description": "Unique identifier for this evaluation sample."
      },
      "dataset": {
        "type": "string",
        "description": "Name of the dataset this data point belongs to. If omitted, inferred from the YAML file name."
      },
      "description": {
        "type": "string",
        "description": "Human-readable explanation of what this sample tests."
      },
      "catalog": {
        "type": "string",
        "description": "Path to a custom catalog JSON file. Supports the '{version}' placeholder. Either this or 'catalogs' is required."
      },
      "catalogs": {
        "type": "array",
        "minItems": 1,
        "description": "The active catalogs, in order; the first is the default. Use instead of 'catalog' to test multi-catalog prompts, per-catalog pruning or per-catalog examples.",
        "items": {
          "type": "object",
          "properties": {
            "path": {
              "type": "string",
              "description": "Path to the catalog JSON file, relative to the repository root. Supports the '{version}' placeholder."
            },
            "catalog_id": {
              "type": "string",
              "description": "Catalog id to use when the document states none."
            },
            "allowed_components": {
              "type": "array",
              "items": { "type": "string" },
              "description": "Component names to keep (ComponentPruningTransformer). Omit to keep every component."
            },
            "allowed_functions": {
              "type": "array",
              "items": { "type": "string" },
              "description": "Function names to keep (FunctionPruningTransformer). Omit to keep every function."
            },
            "examples": {
              "type": "array",
              "items": { "type": "string" },
              "description": "Paths, relative to the repository root, of JSON files holding few-shot example payloads for this catalog."
            }
          },
          "required": ["path"],
          "additionalProperties": false
        }
      },
      "examples": {
        "type": "array",
        "items": { "type": "string" },
        "description": "Paths, relative to the repository root, of JSON files holding few-shot example payloads for the single 'catalog'."
      },
      "allowed_messages": {
        "type": "array",
        "items": {
          "type": "string",
          "enum": ["createSurface", "updateComponents", "updateDataModel", "deleteSurface"]
        },
        "description": "Message types the model may write. Omit to allow all of them."
      },
      "initial_state": {
        "type": "array",
        "items": { "type": "object" },
        "description": "A2UI messages applied to a fresh renderer state before the model's turn is validated, so the turn can update an existing surface."
      },
      "stream_chunk_size": {
        "type": "integer",
        "minimum": 1,
        "description": "When set, the bridge also feeds the completion through the format's streaming parser in slices of this many characters."
      },
      "tags": {
        "type": "array",
        "items": { "type": "string" },
        "description": "Free-form tags used to select subsets of samples, such as 'smoke', 'multi_catalog', 'pruned' or 'stateful'."
      },
      "assertions": {
        "type": "object",
        "description": "Deterministic checks on the compiled A2UI messages, run before the LLM judge. An empty list asserts nothing.",
        "properties": {
          "required_components": {
            "type": "array",
            "items": { "type": "string" },
            "description": "Component types that must appear at least once."
          },
          "forbidden_components": {
            "type": "array",
            "items": { "type": "string" },
            "description": "Component types that must not appear."
          },
          "required_bindings": {
            "type": "array",
            "items": { "type": "string" },
            "description": "Data model paths that must be bound or written, such as '/booking/date'."
          },
          "required_actions": {
            "type": "array",
            "items": { "type": "string" },
            "description": "Action event names that must be dispatched by some component."
          },
          "message_types": {
            "type": "array",
            "items": { "type": "string" },
            "description": "The only message types the payload may contain."
          },
          "catalog_ids": {
            "type": "array",
            "items": { "type": "string" },
            "description": "Catalog ids that must be named by some surface or component."
          }
        },
        "additionalProperties": false
      },
      "messages": {
        "type": "array",
        "description": "Ordered chat completion messages preceding and including the final UI generation request.",
        "items": {
          "oneOf": [
            {
              "type": "object",
              "title": "User Message",
              "properties": {
                "role": {
                  "type": "string",
                  "enum": ["user"]
                },
                "content": {
                  "type": "string",
                  "description": "Text content of the user message."
                }
              },
              "required": ["role", "content"],
              "additionalProperties": false
            },
            {
              "type": "object",
              "title": "Assistant Message",
              "properties": {
                "role": {
                  "type": "string",
                  "enum": ["assistant"]
                },
                "content": {
                  "type": "string",
                  "description": "Optional text response generated by the assistant."
                },
                "tool_calls": {
                  "type": "array",
                  "description": "List of tool calls made by the assistant in native Inspect AI ToolCall format.",
                  "items": {
                    "type": "object",
                    "properties": {
                      "id": {
                        "type": "string",
                        "description": "Unique identifier for the tool call."
                      },
                      "type": {
                        "type": "string",
                        "enum": ["function"],
                        "default": "function"
                      },
                      "function": {
                        "type": "string",
                        "description": "Function name directly as a string."
                      },
                      "arguments": {
                        "type": "object",
                        "description": "JSON dictionary of function arguments."
                      }
                    },
                    "required": ["id", "function", "arguments"],
                    "additionalProperties": false
                  }
                }
              },
              "required": ["role"],
              "additionalProperties": false
            },
            {
              "type": "object",
              "title": "Tool Response Message",
              "properties": {
                "role": {
                  "type": "string",
                  "enum": ["tool"]
                },
                "content": {
                  "type": "string",
                  "description": "Execution output returned by the tool."
                },
                "tool_call_id": {
                  "type": "string",
                  "description": "Identifier linking this tool response to its preceding assistant tool call."
                },
                "function": {
                  "type": "string",
                  "description": "Optional function name for the tool response."
                }
              },
              "required": ["role", "content", "tool_call_id"],
              "additionalProperties": false
            },
            {
              "type": "object",
              "title": "System Message",
              "properties": {
                "role": {
                  "type": "string",
                  "enum": ["system"]
                },
                "content": {
                  "type": "string",
                  "description": "System instruction prompt."
                }
              },
              "required": ["role", "content"],
              "additionalProperties": false
            }
          ]
        }
      },
      "promptText": {
        "type": "string",
        "description": "Legacy single-turn user prompt (deprecated; automatically migrated to messages)."
      },
      "target": {
        "type": "string",
        "description": "Expected outcome and rubric criteria for LLM-as-a-judge scoring. If omitted, defaults to description."
      },
      "system_prompt": {
        "type": "string",
        "description": "Domain-specific system prompt unrelated to A2UI (e.g., application persona, business rules). Merged with the A2UI SDK system prompt during solver execution."
      },
      "protocol_role": {
        "type": "string",
        "description": "A2UI protocol role instruction passed to the SDK prompt generator."
      },
      "role_description": {
        "type": "string",
        "description": "Legacy alias for protocol_role."
      },
      "generation_rules": {
        "type": "string",
        "description": "A2UI protocol workflow rules appended to the SDK workflow prompt."
      },
      "workflow_description": {
        "type": "string",
        "description": "Legacy alias for generation_rules."
      },
      "allowed_surface_ids": {
        "type": "array",
        "items": {
          "type": "string"
        },
        "description": "Allowed surface IDs for the output."
      }
    },
    "required": ["name", "description"],
    "allOf": [
      {
        "anyOf": [
          {
            "required": ["catalog"]
          },
          {
            "required": ["catalogs"]
          }
        ]
      },
      {
        "anyOf": [
          {
            "required": ["messages"]
          },
          {
            "required": ["promptText"]
          }
        ]
      }
    ],
    "additionalProperties": false
  }
}
